{"budget":{"budgetVersion":"volume-tile-cache-budget-v1","estimatedCanonicalBytes":2048,"maximumCacheBytes":196608,"maximumCanonicalBytes":65536,"maximumConcurrency":2,"maximumPeakWorkingBytesPerChunk":24576,"maximumRetainedBytes":196608,"maximumWorkingBytes":442368},"cacheContractVersion":"volume-tile-cache-contract-v1","canonicalChecksum":"84ebc244296d1c6980867cb4bcd0c5886fceb5078888665665b50afd48f744cf","csgPlanBinding":{"bindingContractVersion":"volume-tile-cache-csg-binding-v1","bindingVersion":1,"sourceVolumeCsgPlanChecksum":"43de3aa65d0c5ae90c1c681135483b71ed4c1fd64f0f8b1327b47d06e2ad448d"},"kernel":{"chunkEdgeBlocks":16,"haloBlocksXyz":2,"kernelVersion":"volume-tile-cache-v1","maximumConcurrentChunks":2,"maximumFluidIntervalsPerColumn":64,"maximumRetainedChunks":16,"maximumSolidIntervalsPerColumn":64},"planVersion":1}